{"availability_summary":{"first_available_at":"2026-08-28T13:30:05Z","interval_count":5,"last_available_at":"2026-08-28T13:36:30Z"},"created_at":"2026-08-31T00:00:00Z","dataset_id":"phase1-fixture-dataset","dataset_version":"phase1-fixture-dataset-0.1.0","date_ranges":{"ohlcv-fixture-v1":{"first_observed_at":"2026-08-28T13:30:00Z","last_observed_at":"2026-08-28T13:35:00Z"}},"normalization_policy_version":"normalization-policy-0.1.0","phase":1,"quality_status_counts":{"CORRECTED":1,"INVALID":1,"MISSING":1,"STALE":1,"UNKNOWN":0,"VALID":2},"record_count":6,"replay_fingerprint":"1ccb989ff5d6d9426322d33bc58cf9fb068d4461119b8c57ca10db1bd3ccb265","session_calendar_version":"session-calendar-0.2.0","source_hashes":{"ohlcv-fixture-v1":"922f8cf2569422353e53d960af77a2e8c4e30d7866cc4ea27983319f890ece66"},"symbol_map_version":"symbol-map-0.1.0"}
